,날짜,기업명,정제된 댓글,상승_하락
9667,2023-02-03,위메이드,드루와 드루와 안티들아 엔씨 풉 야야 엔씨 노리고 단타진입할거야 그런데 말이야 위메이드 시총 조 엔씨소프트 시총 조 초보안티야 엔씨소프트는 그냥 게임제조업 하는 일반회사고 위메이드는 나름 신사업이다 잘들어라 주가상승의 베팅을 할땐 수익률 목표를 얼마를 잡을까이다 넌 엔씨가서 의 기대감 먹음되고 난 코인게임거래소 게임플랫폼의 기대감이 있는 위메이드를 산거다 당근 위메이드가 시총 조면 안산다 뭔말인지 몰겠지만 넌그냥 린저씨들 빨아먹는 게임 제조업 엔씨사면되 퐈이아,1
9668,2023-02-03,위메이드,위믹스 잘 나가네,1
9669,2023-02-03,위메이드,프로 잘먹었다 꺼억 안티 공매충들 아직도 깝죽거리는지는 모르겠는데 열심히 해라 수고 월요일 조정 주면 다시 매집해줄게,1
9670,2023-02-03,위메이드,동접 오늘 만 뚫을 것 같다 공매한 사람들 잠 못 이루는 주말이 될 듯 싶다,1
9671,2023-02-03,위메이드,위믹이 백 백원할때는 올라가는속도가 거북이 등딱지같아도 천언넘어서면 진짜금방 천원 천원간다 속도가 장난이 아니지 혹시나 이상태에서 빗썸에라도 상장하게되면 완전 로켓보다 빨리오르겠지 코인홀더들은 위메주주보다 더 행복해질수있다,1
9672,2023-02-03,위메이드,메타 미국 메타 사상최대상승 우리위메이드에게도 큰호재아닐까요,1
9673,2023-02-03,위메이드,안티들아 힘내라 앞으로 주가 만 만갈수도 있으니 체력보강도 단디하고 매일같이 아갈파이터하는게 에너지 소모가 대단할텐데 주가까지 올라가면 스트레스 받아서 더 힘들거잖아 그러니 새벽시간에는 글쓰지말고 일찍자고 주가 펌핑할때는 쥐죽은듯이 숨어있고 그래야 찬티들한테 다구리 안당하지 힘들내라,1
9674,2023-02-03,위메이드,거래량 이빠이 붙었고 너튜브에서 호평중이니 당분간 많이 오르겠네 나스닥 선물장 개판이라 많이 못 올렸는데 이제 한번 터질 타이밍인갑네,1
9675,2023-02-03,위메이드,고팍스에 위믹스들어갈수있을까 바이낸스가 고팍스지분확보했네 개인적으로 원화마켓에 재상장했으면 좋겠다,1
9676,2023-02-03,위메이드,이것드라 미르 나 만들어라 는 재미없어 지 다또 처럼 만들면 안한다,1
9677,2023-02-03,위메이드,위믹스윌렛 아직도먹통인가요 지우고다시다운받아도 매수 매도가안되는데 거래되는분들있나요,1
9678,2023-02-03,위메이드,개월된 주린이라 정말 궁금해서요 미르 이나 위믹스 또 상반기에 출시될 게임들 현 상황처럼만 순항한다면 선배님들 주가 십만원 넘어갈까요 진짜 가능 할까요 현재 목표주가는 원인데요,1
9679,2023-02-03,위메이드,헷갈린다 왜 오른거냐 게임이 흥행해서 아님 위믹스가 폭등해서 게임은 폭망이라 하던데 얜 두가지가 있네 주가방어용 게임 코인 대단하다 위메이드,1
9680,2023-02-03,위메이드,장대표 이시대의 진정한 프론티어 정신을 가진 위대한 인물 남들이 조롱하고 비난해도 자기의 길을 꿋꿋하게 가고 있다 왠지 성공할 것 같다,1
9681,2023-02-03,위메이드,과금유도는 게 하는데 과금안해도 꾸준히만 하면 할만함 그래서매출이 낮나 개똥망인데 기업설명회하지말지 했다하면 폭락하는 기적의 회산데,1
9682,2023-02-03,위메이드,고팍스 바이낸스 바이낸수가 인수하고 바이낸스에 위믹스 상장좋은 시나리오네,1
9683,2023-02-03,위메이드,위믹이 향해 순항중,1
9684,2023-02-03,위메이드,기업설명회 일날 기업설명회 때까진 꾸준히 끌어 올리겠죠,1
9685,2023-02-03,위메이드,공매 알바 안티들 싫어서 적는 위메 주주분들 확인사항 공매 알바 같아서 정보 공유 합니다 무지성 언플과 허위사실은 귀닫고 무시하시고 제가 열거한 팩트만 사실인지 확인하시고 투자에 참조하시길 미르 글로벌 대 흥행 일전 오픈한 신작이 지금 엄청난 열풍입니다 동접자수 어마어마해요 오늘 막판 스퍼트도 아마 미르 글로벌 주말 접속자수 증가를 알기에 매수하거나 공매더 숏커버 한거일겁니다 차기작 애니팡 글로벌 소셜 카지노등등 위믹스 플랫폼하의 신작이 대기중 토큰으로 도박을 즐길수 있는 글로벌 바다이야기 대기중입니다 흥행할거 같나요 안할거 같나요 오히려 국내 거래서 없어져서 규제 없어 좋음 위믹스 및 각종 암호화폐 토큰 떡상중 그제 파월이 이빨 빠진 소리 한후 전세계 불장이 꿈틀대는속에서 앱토스 및 원조 앱토스인 위믹스가 꿈틀대고 있어요 그와중에 흥행을 떠나 현재 기준으로만으로도 환전 수수료가 일 억 이상 나오는 중입니다 공매도 넘들이 앞일 예상 못하고 깔아 놓은 수량이 어마어마 합니다 그거 전부 이 불장에 되사야 되는 겁니다 오늘 양봉 하나에 팔지 말고 버티면 알아서 점점 더 비싼 가격에 살수밗에 없는 물량이 넘쳐 있습니다 우리 주주로 비교하자면 주식은 물려있는데 반대매매가 코앞인 상황이죠 결론적으로 우상향은 뻔히 보이고 시간은 주주편이니 맘 넣고 일희일비 하지마시고 몇달만 두고 보세요 주가가 어디 가있는지 이상,1
9686,2023-02-03,위메이드,어디 숨으셨나용 쥐 구 멍 멍멍 공매도 평단가 조회는 개인정보라 증권사에서 종합이 불가능 합니다 대량공매도 공시 시점이 만 위에서메릴린치 만원대에서 모간서 입니다 홧팅 공매 알바 인가 알지도 못하는 지식으로 샬라샬라 역정 내는거보니 안타깝다 자기가 먼말 하는지도 모를거야 한달 기준 공매 얘기하는데 뭔 수익이 났다는겨 어디서 사서 어디서 팔아야 수익이 나냐 날짜랑 수량이 다 나오는 지금 시스템에서 이 뭔,1
9687,2023-02-03,위메이드,앗 글보고 능지를 알아버렷다 공매도 손실이라고 숏커버 치라고 하는데 암만 계산해도 아직 수익 널널한거야 몇분 댓글 보고 알았네 그래 몇명은 공매도 손실이겠지 개인 공매도 금지 종목같은데 누군 가능 하나보지 암만 계산해도 대규모 공매도 친애들은 수익이 널널한데 한분 글보고 능지를 이해하고 무릎 탁 치고월요일에 뵙겠습니다,1
9688,2023-02-03,위메이드,응 개믹스 달러 간대자나 장회장이 믿고사줘 빨리 더더더 많이 많이사,1
9689,2023-02-03,위메이드,갑자기 안티 알바들이 넘쳐나는 이유 공매도 한달 누적만해도 만주 저거 지금 이 불장에서 다 사서 갚아야함 안티 명써도 부족할 지경,1
9690,2023-02-03,위메이드,여긴아직도 미르타령이네 그래서 동접자 타령하지말고 그 잘난 매출순위 올리봐라 잘되봐야 미르 처럼 개망하겟지,1
9691,2023-02-03,위메이드,필리핀 한달 월급이 지금 만 천원 천원 정도 한데 작업장 가능 할지도 호재 아닌가,1
9692,2023-02-03,위메이드,몰빵 만주 잘부탁한다,1
9693,2023-02-03,위메이드,나이따 또 시외상 터 네 여기도 힘내 할 수 있써,1
9694,2023-02-03,위메이드,닥사 와 빗썸 등 국내거래소 곳 선긋고개별 적으로 상폐 등록 할뜻 비춤뉴스나오고 그렇게 되면 위믹스 국내 재상장 가능성 열릴 확률도매우 높아짐 위메이드는 조금 길게 보면 성장성 매우크게 부활 할듯 기대해도 조음 위믹스 국내상장 이 빨리대길 빌어봅시다,1
9695,2023-02-03,위메이드,이제 시작인거 같은데 추세를 거슬러 후회한게 한두번인가 이제 시작인데 기회줄때 시외 기회 포착이다,1
9696,2023-02-03,위메이드,자 주말은 공매알바는 게시판과 함께 여기공매알바 안티애들아이디 다 똑같은 애들 다 외우셨죠 하도 글써서 공매끄나플 공매끄나플 니들은 주말에도 게시판끼안고 짖어대며 살아라 아직 오를려면 멀었는데 쫄긴,1
9697,2023-02-03,위메이드,사필귀정 년 월 일 오후 시경에 상폐정보 사전유출 의심속에 위메이드 급락하고 머니투데이 이하늬기자 상장폐지 사전유출 기사 미리 나오고 갑자기 위믹스 급락하며 공매도세력들은 숏거래로 대박나고 그와중에 거래소들은 수수료장사 해처먹고 업비트 대표가 에 사필귀정 이라고 감정적으로 언급했을때의 분노는 이루 말할수도 없었습니다 절대 잊지 않겠습니다 사필귀정 기다리고 또 기다리면 머지않아 오늘보다 더 좋은 날이 있으리라 간절히 두손모아 염원해봅니다,1
9698,2023-02-03,위메이드,정확한 동시접속자수 공개 년 월 만명 년 월 만명 년 월 만명 그리고 미르글로벌 대박이라고 구라치는데 현재 시간 동시접속자수 만명이다 신규는 없고 기존에 오토돌리던 동남아 애들이 그대로 미르 글로벌로 이동해서 고인물 파티중,1
9699,2023-02-03,위메이드,주식은 요런종목을 길게 봐야 한다 원 두번 바닥 다졌다 달만에 만원 안착 축 여기 저기 급등 날파리들 처럼 들러 붙는 종목 아니다 위메이드이번달 만이상 본다 그냥 쳐다도 보지말고 담궈두셔 잔걸음이 되든 점프를 할지는 모르니 길게 보셔 주말들 잘보내셔,1
9700,2023-02-03,위메이드,공매 쥐새키들 종가 단일가 조작질하다 곧 된통 맛이 가겠네 그러다 족 멸망한다,1
9701,2023-02-03,위메이드,닥사의상폐가 헛되지않길 위메이드의 죽이지않으면 더 단단하다는정신을 제발 보여주길 차분한게나은듯 미르 도 비극의터널이 분명 시간이해줄거임,1
9702,2023-02-03,위메이드,오늘 털리애들 주식하지마 조용히 가자 그래야 크게간다,1
9703,2023-02-03,위메이드,위믹스 한달간 가까이 상승 위믹스 코인도 살아나도 위메이드도 살아나고 가즈아 내용출처,1
9704,2023-02-03,위메이드,단일가 원 돌파하자 종가 물량은 훼이크,1
9705,2023-02-03,위메이드,연기금이 매수를 월요일 기대되네,1
9706,2023-02-03,위메이드,줘털린건가 점심시간 끝나기전에 줄 때 먹자 하고 줘 팔았더니 오늘 바닥에서 던졌네,1
9707,2023-02-03,위메이드,광고쟁이들 들러붙은거봐 퍼 올랐으니깐 봐줄께,1
9708,2023-02-03,위메이드,위믹스 얼마까지 오르나 기대한다 평단 원 짜리인데,1
9709,2023-02-03,위메이드,이제 맘편히 위믹스보면되냐,1
9710,2023-02-03,위메이드,자꾸 헛소리를 해대노 주가 안오른다며 넌 이게 안오른거냐,1
9711,2023-02-03,위메이드,광고충들아 광고해 개미들 돈 먹으려 하지말고 그렇게 좋으면 위메이드 사거떼돈 벌러라,1
9712,2023-02-03,위메이드,매동 어디서 많이 보던 거래량과 매동 아닌교 내 추측이 맞겠네유 화이팅 하이소,1
9713,2023-02-03,위메이드,막판에 올리면서 끝내서 좋구만 질질 흐르길래 여기서 한단계 레벌업할 때까지 한참 또 걸리겠다 싶었는데다행히 막판에 올리면서 끝내내다음주도 기대해 보겠다,1
9714,2023-02-03,위메이드,위믹스 다시 사야할까요 어디서 사요,1
9715,2023-02-03,위메이드,그래도 고맙다 간만에 주말 안 우울하겠네,1
9716,2023-02-03,위메이드,월요일 갭런 주말이 길겠군요,1
9717,2023-02-03,위메이드,단타개미들 보유물량 별루 안남았겠다능 낼부터 거래량 작아도 쉽게 오르든 내리든 하거따능,1
9718,2023-02-03,위메이드,바이낸스 상장하면 위믹스 만원도 감,1
9719,2023-02-03,위메이드,만원의 영광을 다시 한번 더 현재 평단 수익이 억이 되었을때 팔아야했는데이렇게 맘고생 할 줄이야,1
9720,2023-02-03,위메이드,위메 안착하자 다음주 쭉쭉 달려보자고,1
9721,2023-02-03,위메이드,개 털어먹네 내일 갭상 띄우는거 보면여기 주포 스케일이 나올듯,1
9722,2023-02-03,위메이드,나는 물타도 당신보다 높다 현타 조지게 온다 조회수 신고 원에 사서 하한가 쳐맞고 에 팔았는데 결국 그때 물탔으면 지금 본전 탈출 가능했던거네 인생쓰다 나도 그때 하한가 당연히 봤다 위믹스 상장폐지 그때만인가 그 더 전에 회계관련으로 급락했을 때도 겪었다 제목으로 썼듯 물타도 당신보다 높다 당신은 물탔으면 본전이라 탈출했다는데 난 더 높아 근데 하한가 겪었어도 왜 안팔았냐 손실이 컸으니까 기다린거지 더 관망하며 지켜본거지 그리고 새해엔 더 달라질거란걸 새해엔 정반대될거란걸 꾸준히 최근 기사보고 미래보고 그러며 새해를 기다리며 참아왔다 내 다른 글 보면 그때 상황의 내 글들도 볼 수 있어 하한가 때는 물론 그 더 전에 급락했을 때도 말이다 그리고 이때를 보고 있는거지 나같은 이들 꽤나 많을거야 오늘이 이니 거의 년 걸렸네 원 평단가에서 평단가도 낮추고 다른 주식들 사 손실 매꾸려고 손실보더라도 몇 주 팔고 물타서 주 원 평단가 주 적다 볼 수 있으나 내겐 소중해 원 오른 원,1
9723,2023-02-03,위메이드,이 만대로,1
9724,2023-02-03,위메이드,안착마감 다음주 애니팡 해외 가나요 오늘 첫 발동이네요 이제 위메이드 제대로 가봐야지요 카카오도 만원대 판교 불났을때가 다 팔아야 한다고 할때 최저점이었고 지금 두배 갔네요 위메 나이트 크로우가 더 대박 만 최근 전고 터진날 가격까지 가야지요,1
9725,2023-02-03,위메이드,안착마감 다음주 애니팡 해외 가나요 십 만가야합니다,1
9726,2023-02-03,위메이드,금욜일 오후 하방이다,1
9727,2023-02-03,위메이드,종가에 올인,1
9728,2023-02-03,위메이드,상한가 가는데 분 아자자,1
9729,2023-02-03,위메이드,현타 조지게 온다 원에 사서 하한가 쳐맞고 에 팔았는데 결국 그때 물탔으면 지금 본전 탈출 가능했던거네 인생쓰다,1
9730,2023-02-03,위메이드,현타 조지게 온다 그러길래 주식은공포에들어오는겁니다,1
9731,2023-02-03,위메이드,에 털렸었는데 보니까 속쓰리네,1
9732,2023-02-03,위메이드,종가 이면 좋겠습니다,1
9733,2023-02-03,위메이드,투신 주 지속 매수네,1
9734,2023-02-03,위메이드,여기 찬티들 진짜 조심해 물린애들 천지라 계속 객관적인 자료없이 희망적인 글만 쓰고 있음 곧 실적발표 있어 공매도로 폭탄투하 가능함 적당히 단타만 합시다,1
9735,2023-02-03,위메이드,위믹스 짐 가격이 원 꾸준히 오르는중 폭등 이 단어밖에 생각안난다,1
9736,2023-02-03,위메이드,악재 전 먹튀 뇌동매매 추격매매 곧바로 쳐물린다 먹고 튀자,1
9737,2023-02-03,위메이드,팔지마세요 여러분 주박사님께서 담주까지 무조건 홀딩이라십니다,1
9738,2023-02-03,위메이드,미르 동접 만 넘김 주말에 만 넘길듯위믹스 급등하네,1
9739,2023-02-03,위메이드,위믹스 돌파 주말 찍을듯 미르엠 구만넘음 주말동접자 십만뚫을듯 미르 도 한달에 삼만이었다가삼개월후 삼십만됨 미르엠이 네배 더 빠르네요,1
9740,2023-02-03,위메이드,위믹스 은 진작 돌파했고 지금 원 앞에서 못 넘고 공방중입니다 성투하십시오,1
9741,2023-02-03,위메이드,찌밤 기관 외인 공매도 개부럽다 위 아래로 다 발라먹네,1
9742,2023-02-03,위메이드,주가 관계필독 바닥물량 만 있어요 언제나 오버행이슈입니다 그럼 펌핑해서 상친다 소탐대실입니다 저물량 다는아니어도 어느정도 흡수하고가야 상 한방칠거 두방 칩니다 제발 동호회 위믹스 홀더들은 장끝날때까지 입다무세요 불나방 끌어와서 자꾸 주가 오르면 신규입성자만 돈벌어다주는거에요 매집끝나면 주포가 알아서 올립니다 아 주포가 힘들어서 어쩌냐 무식한 위슬람 이해됫음 엄지척,1
9743,2023-02-03,위메이드,위믹스 한국 재상장 논의 하는거 같은데 기사 본거 같은데,1
9744,2023-02-03,위메이드,바이낸스 상장 거의 확실시 되고있는뎅,1
9745,2023-02-03,위메이드,주박사님 감사합니다 주박사님 추천주 메이드 덕분에 난방비 걱정 없어요,1
9746,2023-02-03,위메이드,형들 반등 아니다 네번째 말해띠,1
9747,2023-02-03,위메이드,거래종료전이 육만오천이다 지스닥 국내 해외 거래 팍팍터지고있다 미국 비트마트상장도 대박이네 거래 네배터짐 최소 육만은 차 가야 닥사거래종료전 근데 닥사 내부분열 빗썸 코인원 단독움직임 뉴스도나오네,1
9748,2023-02-03,위메이드,위믹스 실화냐,1
9749,2023-02-03,위메이드,매도는 상한방가고 플러스 십퍼갈때 해라 지금도 저가야 차트봐라,1
9750,2023-02-03,위메이드,위믹이 주말에 돌파도 무리가 아닌듯 보입니다 정말 무습게 오르네요 미르에미 글로벌 흥행이 사실인듯,1
9751,2023-02-03,위메이드,다음주 애니팡해외글로벌도 출시한다 미르엠 이미 대박났고 동접자 미르 한달에 삼만가다가삼십만터졌지 미르엠 한달도 안되고 일인데 만넘음주말되면 더 터지고 이미 미르 보다출발이 네배좋음 다음주 애니팡글로벌도 출시 기본 돌파 세계최대 원 최근전고찍은 후 나이트크로우 십만 봅니다 이제 시작점입니다 두석달매집끝,1
9752,2023-02-03,위메이드,위믹스 이번달안으로 다섯자리가즈아,1
9753,2023-02-03,위메이드,후 갈거에요 지금매수 완료,1
9754,2023-02-03,위메이드,위믹스 미쳤군요 완전히 터졌네요 지닥에서 원 근접입니다 만원까지 함께 가십시다 그동안 날린돈 보상 받아야지요 함께 가십시다 위믹스로 부자되는 길,1
9755,2023-02-03,위메이드,위믹스홀더 필독 시장이 신뢰가 우선되야 위믹스가 더 크게 올라간다 시장의 신뢰는 위믹스 코인 시세가아니라 비즈니스 모델인 모회사의 위메이드 주가인거야 위메이드 주가가 올라야 기사가 쏟아지고 위믹스가 더 폭등하는거야 지금은 신뢰회복 구간이야 미르 홍보 튀기기는 지금 충분히 반영됫고 형이 틀동안 고생햇다 이제 주가 상승으로 신뢰회복 찍고 마이크로소프트같은 투자유치 더 따와야 위믹스가 뛰는거야 멍충이들아 형님들 오전 외인기관 매수물량 지금 턴받아서 소화중이자나 프매 파랭이로 돌아섯다 오전 만주를 에서 저렇게 받는게 누굴거같니 답없는 홀더들 공부좀 더하고 아 이해했으면 엄지척해라 이 눈치없는것들아 퐈이아,1
9756,2023-02-03,위메이드,한번 더했으면 좋겠다 무증 안되냐,1
9757,2023-02-03,위메이드,오늘 물린놈 손 주먹을 꽉쥐고대가리를 후려쳐,1
9758,2023-02-03,위메이드,짱나는 위믹스 홀더들아 주가 매커니즘 모르니 니들이 물리지 걍 다물어 지금 알만한 애들 다알아 입다무는게 도움주는거야 하여간 코인충들이 도움이안되 니들이 입닥쳐야 위믹스한테도 좋아 아마추어들,1
9759,2023-02-03,위메이드,재료는 상한가 깜인데 태국 홍콩 필리핀 위 등극 텐버거 시작을 알리는 첫 종소리가 될것인가,1
9760,2023-02-03,위메이드,위믹스 벌써 달리노 네이스,1
9761,2023-02-03,위메이드,결국 개미가 만주 이상 받아줬네 담주부터 까지 찍고 다시갑니다 퍼 횡보할때 촉수엄금이라고 세번 말 새줬는데 돈을 내다 버리네,1
9762,2023-02-03,위메이드,이제 팔 사람들은 다판거 아이강,1
9763,2023-02-03,위메이드,위믹스 프로 폭등,1
9764,2023-02-03,위메이드,끝났네 에휴 물렸네,1
9765,2023-02-03,위메이드,몸을 움츠렸던 고양이는 높은 담을 뛰어넘지,1
9766,2023-02-03,위메이드,위믹스 원 배 올랐다 최소 배는 후딱 가야지 아직도 이 가격대냐 남들은 그냥 지수만으로도 월 월 세네배 갔다 지수 급등때도 못가고 삼개월 매집만 하고 이제 첨 오르는건데 오늘 상쳐버리자,1
9767,2023-02-03,위메이드,오르내 마내 그르는데 외인하고 기관은 지금 다 털어먹고 나가는중,1
9768,2023-02-03,위메이드,카카오 위메보다 쌌는데 카카오 벌써 만이네 후딱 따라잡자 저평가다,1
9769,2023-02-03,위메이드,위믹스 일딴 날리났네,1
9770,2023-02-03,위메이드,위믹스 원,1
9771,2023-02-03,위메이드,최소 만까지 갑니다 최소 까지 그뒤 까지들고 갑니다,1
9772,2023-02-03,위메이드,차목표가 후 횡보 세계최대 월 미르엠 이미 대박났고 동접자 미르 한달에 삼만가다가삼십만터졌지 미르엠 한달도 안되고 일인데 만넘음주말되면 더 터지고 이미 미르 보다출발이 네배좋음 다음주 애니팡글로벌도 출시 기본 돌파 세계최대 원 최근전고찍은 후 나이트크로우 십만 봅니다 이제 시작점입니다 두석달매집끝,1
9773,2023-02-03,위메이드,위믹스는 계속 오르네요 위메이드 궁디 딱,1
9774,2023-02-03,위메이드,위믹스 폭등중 위믹스 천원은 가볍게 가겠지 지금도 홀로 폭등중 고로 지금 사,1
9775,2023-02-03,위메이드,오전에 익절한 사람이 승리자네 익절 굿,1
9776,2023-02-03,위메이드,위메이드도 좋지만 중국판호 개를 획득한 넷마블 미래 실적을 감안하면 더 좋을것 같아요 넷마블 주봉 챠트를 보시고관심주 등록하시고 지켜 보세요장투하면큰 시세가 터질 가능성이 있어 보이니까요,1
9777,2023-02-03,위메이드,게임 흥행실패 동접 만은 실패,1
9778,2023-02-03,위메이드,종가 프로대 상승 마감,1
9779,2023-02-03,위메이드,죄송합니다 나대지않을께요 살려주십쇼,1
9780,2023-02-03,위메이드,애들아 한방에 자 볼려고 하지말고 왜 상승하는지 앞으로 상승 여력이 있는지를 봐야지 약빨고 올리자나 외인 기관이 받아준다 걱정말고 드가자,1
9781,2023-02-03,위메이드,지금 돌아가는 거 보면 뻔하지 않냐 어거지로 위믹스 가격 쳐올리고 어 미르 돈 좀 될려나 하면서 브라질 필리핀 애들이 하고 있지만 귀신같이 월 일 전에 세력들은 익절하며 위믹스 가격 쳐박고 미르 도 그렇게 버릴거다 그리고 월에 애니팡 월에 크로우 어쩌구로 승부본다면서 또 알바들이 존나게 찬티하겟지,1
9782,2023-02-03,위메이드,오후장 말아 올릴꺼임 거의 상 찍지 않을까조심스러급게 예측다음주는오만에서 움직일것으로 보임안믿어 그럼 믿지마,1
9783,2023-02-03,위메이드,드디어 자가 보였네요 주주 여러분 그간 고생 하셨읍니다 이제부터 랠리는 시작 됐으니 단디 잡으시고 파이팅 합시다 자보일때까지,1
9784,2023-02-03,위메이드,신용미수도없고 만까지는 매물대도 없어 외인이 마음만 먹으면 얼마든지 달릴수 있겠는데 개인들 차익물량이 많아서 그런가 금일장 구간 박스 하단에서 오르락내리락 하는게 달릴까말까 고민되나 보네요 어떤 모습으로 오르는지 지켜보다 따라갈지 결정해야겠다,1
9785,2023-02-03,위메이드,그만좀 떨어져 얼마까지 떨어지노,1
9786,2023-02-03,위메이드,원짜리 원 배 폭등 개믹스 이번에는 만원간대 빨리 다사 힝 어여어여 매수눌러라잉,1
