,날짜,기업명,정제된 댓글,상승_하락
6948,2023-02-03,코오롱모빌리티그룹,내려왔다 다시 매수 하자 지금이 매수 기회,1
6949,2023-02-03,코오롱모빌리티그룹,사기꾼집단 애들은 아예 올릴 계획도일거리도 없는 양아치 회사다첨부터 사기주식이다금감원 합새해서개미 피빨아먹는 양아치 색끼다,1
6950,2023-02-03,코오롱모빌리티그룹,우선주 상가야지 천원때나가지,1
6951,2023-02-03,코오롱모빌리티그룹,개미들 죠센징 들 망해라 니들은 안되갯다,1
6952,2023-02-03,코오롱모빌리티그룹,다 게어내 바닥으로 슉슉 나를 무시햇어,1
6953,2023-02-03,코오롱모빌리티그룹,거래량이 아깝다 우선주상못가면 지하구경하겠네,1
6954,2023-02-03,코오롱모빌리티그룹,프로 늘 언제나 퍼손절친거 여기서메꿀라구 에들어오니보란듯 폭락,1
6955,2023-02-03,코오롱모빌리티그룹,우선주 애들 다 본주로 쳐 넘오나 민폐네 본주 기가 꼬라지 하고는,1
6956,2023-02-03,코오롱모빌리티그룹,우선주 풀렸네 돔,1
6957,2023-02-03,코오롱모빌리티그룹,작전주 개미들한테 많이 떠넘기고 있지 개미들 곡소리 들리것다,1
6958,2023-02-03,코오롱모빌리티그룹,상한가 따라잡기 거저먹지말자 엉덩이 본드로 붙혀놔,1
6959,2023-02-03,코오롱모빌리티그룹,천원은 가자,1
6960,2023-02-03,코오롱모빌리티그룹,간 다,1
6961,2023-02-03,코오롱모빌리티그룹,평단 원입니다 밥이 목구녕에 안넘어가고세상이 왜 나한테만 각박한가 싶고너무너무 죽고싶읍니다,1
6962,2023-02-03,코오롱모빌리티그룹,평단 오천원인데 이만 튈까 꼬락서니가 오늘 안 갈거 같은데,1
6963,2023-02-03,코오롱모빌리티그룹,시이후에는 이상이다 담주 상함찍자,1
6964,2023-02-03,코오롱모빌리티그룹,담주 를 기대하며 담아보자,1
6965,2023-02-03,코오롱모빌리티그룹,축하한다 거래량은 모쏙인다 난 자러 간다 상한가 알람 맞춰놓고 간다,1
6966,2023-02-03,코오롱모빌리티그룹,하루살이 초파리들 천지네,1
6967,2023-02-03,코오롱모빌리티그룹,개물렸네 하 진짜 적같다,1
6968,2023-02-03,코오롱모빌리티그룹,소용없다 넌 폐지 땅땅땅,1
6969,2023-02-03,코오롱모빌리티그룹,개주식은 하루종일 빼쳐먹는 개 양아치 주포개관넘 다 디뎌라그만꺼져,1
6970,2023-02-03,코오롱모빌리티그룹,이제는 우리가 상칠차례 우랑 바꿔서 가즈아,1
6971,2023-02-03,코오롱모빌리티그룹,이건 못가겟다 빼길잘햇네,1
6972,2023-02-03,코오롱모빌리티그룹,상장폐지 할래 없애버려라,1
6973,2023-02-03,코오롱모빌리티그룹,우선주 상갔다 우리도 가자,1
6974,2023-02-03,코오롱모빌리티그룹,상한가 거론하는것들 신종 바람잡이냐 고마해라,1
6975,2023-02-03,코오롱모빌리티그룹,밥먹고 왔다 다시 가자 다시 천원 위로,1
6976,2023-02-03,코오롱모빌리티그룹,왜 생명과학은 똥싸지르고 모빌리티 어쩌구 한다냐 요즘 애도안낳서 아가들도 없다는디 모빌은 맹그러서 뭐데쓸라꼬 똥 을때 쓸꺼냐 하야간 코롱짜는 에스께이 마냥죄다 사기질 옛날 같으면 남산에 부러서 죽빵을 처 날려삐는건데 세월이 조타,1
6977,2023-02-03,코오롱모빌리티그룹,너도 가자 상으로,1
6978,2023-02-03,코오롱모빌리티그룹,쏘아올려 힘들다,1
6979,2023-02-03,코오롱모빌리티그룹,인간적으로 매도벽이 통곡의 벽이네,1
6980,2023-02-03,코오롱모빌리티그룹,천냥 갈 주식이 이렇게 개미덜에게 기회를 준다 죠센징 답다,1
6981,2023-02-03,코오롱모빌리티그룹,형님들 매집 적당히 하고 갑시다 이게 대체 몇시간째요,1
6982,2023-02-03,코오롱모빌리티그룹,코오로 모발라띠 그룹 이룸 참 거시기하네 개미들 천지구먼 죠센징 망해라,1
6983,2023-02-03,코오롱모빌리티그룹,상한가에서 봅시당 거래량 죽이네요 오늘 최대거래량 갱신 세력 완전 매집 갑니다요,1
6984,2023-02-03,코오롱모빌리티그룹,여튼 만은 학실,1
6985,2023-02-03,코오롱모빌리티그룹,끝 오늘 다 나보네,1
6986,2023-02-03,코오롱모빌리티그룹,광고 찬티들보니 오늘 글렀네 아오 한방 기다리고 있는데 우짜노 슛팅한방은 있을것 같아 보이는데,1
6987,2023-02-03,코오롱모빌리티그룹,언 시간 먹고간다 퉤 짜피 돈없는애가자전중,1
6988,2023-02-03,코오롱모빌리티그룹,광고들 꾸득꾸득 기어나오는걸 보니 오늘은 글렀네 상한가 가나 했더니 상하것다야,1
6989,2023-02-03,코오롱모빌리티그룹,이 개잡주는 매물만 쏟아내는 양아치 개 넘들돈없는 주포색키땜에조지는 주식 다매수금지,1
6990,2023-02-03,코오롱모빌리티그룹,절대 못 간다 이미 오전에 시세 주고 끝났다,1
6991,2023-02-03,코오롱모빌리티그룹,매집 끝나면 올리겠지 느긋하게 기다려봐요 떨어지면 추매,1
6992,2023-02-03,코오롱모빌리티그룹,인간적으로 오늘 상은 못가지 에서 종가마감해도 감사해야할듯,1
6993,2023-02-03,코오롱모빌리티그룹,어제 술퍼먹고 방금 백 십 익절했다 생유 음봉에서 모아가자 다음 타자는 그저께 상한까 친놈 음봉인놈 아고 머리야 띵하네,1
6994,2023-02-03,코오롱모빌리티그룹,다음주 부터는 고공행진이닷,1
6995,2023-02-03,코오롱모빌리티그룹,아휴 우선주 상 안착시킨후관심받지 그러믄 설거지 타임 굿 되는거여물량다털어낼려면 시간이걸린다 그래서우선주를버티기하다가 본주먼저 설거지 이걸 들간다면 새 되는기다,1
6996,2023-02-03,코오롱모빌리티그룹,흠 내가 성급했다 이건 상 못간다 슛팅 한번 올듯 탈출기회 노리는중,1
6997,2023-02-03,코오롱모빌리티그룹,어디 동호회 찌라시 돌았냐 어여어여 빼라 확 주저앉고 동아리 내부에서 쌈 나기전에,1
6998,2023-02-03,코오롱모빌리티그룹,흑우새기덜 또 당하는구먼 에라이,1
6999,2023-02-03,코오롱모빌리티그룹,오늘 손절 개미들 지금이라도 매수 추천 시총이 아직 천억대 이건 대한민국 그룹 망신 말도 안됨,1
7000,2023-02-03,코오롱모빌리티그룹,오늘 상이라고 하 답답,1
7001,2023-02-03,코오롱모빌리티그룹,상 말기전에 장난질 엄청하겠군모두 존버,1
7002,2023-02-03,코오롱모빌리티그룹,고점의 개미들 허우적 허우적 주가조작 관련 의심이,1
7003,2023-02-03,코오롱모빌리티그룹,하염없이 흐른다 할레루야,1
7004,2023-02-03,코오롱모빌리티그룹,상한가 가즈아 상한가 말아 올린다,1
7005,2023-02-03,코오롱모빌리티그룹,추매 안한 흑우 없지,1
7006,2023-02-03,코오롱모빌리티그룹,원 살려주세요,1
7007,2023-02-03,코오롱모빌리티그룹,흑우새기덜 또 달려드네 에라이,1
7008,2023-02-03,코오롱모빌리티그룹,본주보다는 우선주가 낳을듯하네요 본주 손절 우선주로 넘어갑니다,1
7009,2023-02-03,코오롱모빌리티그룹,우선주를 상푸는 장난치는거보니 나는 다시 달릴거라고본다,1
7010,2023-02-03,코오롱모빌리티그룹,아무뉴스쳐없이 오르는건 한계가있음,1
7011,2023-02-03,코오롱모빌리티그룹,매도하니까 한결좋네 맛나게 먹고 나가연,1
7012,2023-02-03,코오롱모빌리티그룹,어설프게 단타칠려니까 맨날 물리지 손절한놈 어 어 하다가 또 물렸다에 내 왼쪽 부랄건다,1
7013,2023-02-03,코오롱모빌리티그룹,장난질 심하긴 하네 우선주 상풀었다 닫는거보소,1
7014,2023-02-03,코오롱모빌리티그룹,분전에 단타분들은 빠지라고 했어요 전 코오롱글로벌 인적분할로 들고 있는거라 보너스 개념이기에 편안하게 보는 거고 단타치러 왔다면 아까 손절이든 익절이든 했을 겁니다 모두 맛점하세요,1
7015,2023-02-03,코오롱모빌리티그룹,여기 끝났나요 내 돈 자동존버,1
7016,2023-02-03,코오롱모빌리티그룹,토껴 랄부에 종소리 나두룩 돔향챠,1
7017,2023-02-03,코오롱모빌리티그룹,분봉 작살이네 튀어 종배는 금욜이라 후댕긴다,1
7018,2023-02-03,코오롱모빌리티그룹,어어 빠진다 물론 난 없지,1
7019,2023-02-03,코오롱모빌리티그룹,오우 심약 개미들 어쩌냐 버티기냐 슈팅 기대하며 홀딩이냐,1
7020,2023-02-03,코오롱모빌리티그룹,우선주 보다 못한 본주 에이,1
7021,2023-02-03,코오롱모빌리티그룹,평단 원입니다 정말 엄마한테 너무 미안하고 너무너무 죽고싶읍니다,1
7022,2023-02-03,코오롱모빌리티그룹,라인 잡아주죠 좀더 본다,1
7023,2023-02-03,코오롱모빌리티그룹,안티 내 많네 더간다,1
7024,2023-02-03,코오롱모빌리티그룹,시총만보고 달리샘 우선주는 담 래일도 상한일듯 그룹 실 대비 넘 저평가 시총 이직도 천억대,1
7025,2023-02-03,코오롱모빌리티그룹,일단 일단 토껴라 윗꼬리 길게 단다,1
7026,2023-02-03,코오롱모빌리티그룹,무조건잡아라 거래좋고 상들어가면 월요일 손가락 빤다,1
7027,2023-02-03,코오롱모빌리티그룹,주포 양아치다 조심,1
7028,2023-02-03,코오롱모빌리티그룹,쫄리는 구간전부 다 던짐,1
7029,2023-02-03,코오롱모빌리티그룹,익절라인 더 갈줄 알았는데 히히,1
7030,2023-02-03,코오롱모빌리티그룹,만원간다,1
7031,2023-02-03,코오롱모빌리티그룹,폭포수다 튀어라 된다,1
7032,2023-02-03,코오롱모빌리티그룹,단타치러 오신분들은 탈출기회 차트가 깨지고 있어요 단타 아니라면 홀딩,1
7033,2023-02-03,코오롱모빌리티그룹,판타지코오롱먼트 진도준입니다 만원까지 갈거라고 하더라구요,1
7034,2023-02-03,코오롱모빌리티그룹,흠 야는 안되겟다잉,1
7035,2023-02-03,코오롱모빌리티그룹,진입했는데 응 되었다,1
7036,2023-02-03,코오롱모빌리티그룹,뉴스있나요 호재는요 주 재료가 모조 그룹 상장이면 만은 가야되는거 아닌가요,1
7037,2023-02-03,코오롱모빌리티그룹,우선주시총이 억인데 본주가 홀로서기해서 주가부양하지 않는 이상 상당히 횡보가 위험한 종목,1
7038,2023-02-03,코오롱모빌리티그룹,이거 시총 백만 총주식수 백만주 쉽게 가겠냐 엉댕이 모거워서,1
7039,2023-02-03,코오롱모빌리티그룹,어제 얘기했다 이제 층 볼일 없다고 진득히 들고 있음 원은 그냥 가주는 종목인걸 왜 모르지,1
7040,2023-02-03,코오롱모빌리티그룹,역시 시총이 말도 안되게 천억이 머냐였어 그룹 실적대비 구멍가게 수준 중소기업도 수두룩,1
7041,2023-02-03,코오롱모빌리티그룹,돈워리 만은 가여 오늘은 이상,1
7042,2023-02-03,코오롱모빌리티그룹,모빌리티 그게 돈이됩니까 순양이다 순양,1
7043,2023-02-03,코오롱모빌리티그룹,단타성 객상승은 결국 재자리 다시 오후 퍼랭이,1
7044,2023-02-03,코오롱모빌리티그룹,우선주상보내고 본주설거지하는 전형적인 패턴임 우선주상갔으니 본주도 상가겠지 심리의 개미들한테 물량다떠넘김,1
7045,2023-02-03,코오롱모빌리티그룹,그룹에서 미리 시총 대비 했을테니 안심하고 추매,1
7046,2023-02-03,코오롱모빌리티그룹,고수입니다 잘 묵고 갑니다,1
7047,2023-02-03,코오롱모빌리티그룹,평단 원입니다 밥이 목꾸녕에 안넘어가고 너무너무 죽고싶읍니다,1
7048,2023-02-03,코오롱모빌리티그룹,평단 원입니다 이거 도라지가 뭔 멍멍 하노,1
7049,2023-02-03,코오롱모빌리티그룹,재벌주라서 그런지 매집하는게 참 터프하네 역시 재벌 세 클라쓰,1
7050,2023-02-03,코오롱모빌리티그룹,아 팔앗다 휴,1
7051,2023-02-03,코오롱모빌리티그룹,휴 간만에 단타 잘치고간다 수고들혀,1
7052,2023-02-03,코오롱모빌리티그룹,재벌집막내아들 생각나네 그룹에서 대놓고 작전,1
7053,2023-02-03,코오롱모빌리티그룹,좀 벌었네요 아침에더살껄 에서 추매못하고 퍼만 먹고갑니다 개아깝네,1
7054,2023-02-03,코오롱모빌리티그룹,이걸 털리냐 상인디,1
7055,2023-02-03,코오롱모빌리티그룹,오늘 코오롱주 모조리 우상향 상을향하여 가자,1
7056,2023-02-03,코오롱모빌리티그룹,월봉꼬리봐라 힘이장사네,1
7057,2023-02-03,코오롱모빌리티그룹,달려라 코오롱 세 상한가찍자,1
7058,2023-02-03,코오롱모빌리티그룹,세력 들어왔군 장오픈 시간 만주 매입중,1
7059,2023-02-03,코오롱모빌리티그룹,다른 종목글 보더라도 간다고 한게 이번 처음 아까 제 글 보고서 뇌동매매로라도 들어오신분들 수익 축하드립니다,1
7060,2023-02-03,코오롱모빌리티그룹,간단하게 그룹주는 시총을 감안하게 되어 있지요 갈길 멀었어요 일단 조 가까이 만들겁니다,1
7061,2023-02-03,코오롱모빌리티그룹,센놈이다 이거 세 경영 이거 졸라쎈놈임,1
7062,2023-02-03,코오롱모빌리티그룹,만원 만원 설레발치고싶넹,1
7063,2023-02-03,코오롱모빌리티그룹,와전고점 가는구나 원부터 매수다시들어갈랬는데 버틴사람 고생하셨어요 잘수익내시길 전 어제 털렸지만 손절한건아니니 큰 미련은 없네요 치킨값벌고 탈출했는데 치킨먹으면서 반성할게요 평단 원 올림,1
7064,2023-02-03,코오롱모빌리티그룹,어설푼 기술주도 만원인데 공식 수입 판매와 서비스를 제공하는 회사가 천원이라니,1
7065,2023-02-03,코오롱모빌리티그룹,코오롱모빌리티 전기차 수소차 신사업 동력 박차 공시 발표 임박,1
7066,2023-02-03,코오롱모빌리티그룹,고점개미들아 빨리 털어라 그래야 올라간다,1
7067,2023-02-03,코오롱모빌리티그룹,상 가겄네 우선주랑 둘다 개꿀이네,1
7068,2023-02-03,코오롱모빌리티그룹,코오롱모빌리티그룹우 마넌 간다나머라나,1
7069,2023-02-03,코오롱모빌리티그룹,만원 설레발치고싶다,1
7070,2023-02-03,코오롱모빌리티그룹,효자종목이다,1
7071,2023-02-03,코오롱모빌리티그룹,우선주 상풀리네 흑우들아 어쩔,1
7072,2023-02-03,코오롱모빌리티그룹,아직 시작 단계인듯 지금부터 멋지당좋구나 좋아,1
7073,2023-02-03,코오롱모빌리티그룹,만 넣고 만잘먹고 갑니다 거어억,1
7074,2023-02-03,코오롱모빌리티그룹,데헷 믿구있었다구,1
7075,2023-02-03,코오롱모빌리티그룹,우 상한 축하드립니다,1
7076,2023-02-03,코오롱모빌리티그룹,코오롱 세 경영 세습 주다 장남 첫 경영인데 힘좀몰아주자,1
7077,2023-02-03,코오롱모빌리티그룹,깨고 올려준다는 약속 지켰다,1
7078,2023-02-03,코오롱모빌리티그룹,야 고만가라 세력아 아 팔아버렸는데 이거 코오롱 글로벌 시총뺏고 저평가를 자동차섹터로 현재 로 맞추려는 계획이였던것이냐,1
7079,2023-02-03,코오롱모빌리티그룹,호가창 보지말라켓제이 떨어지면 모아가라해따이 세력들 물량 싹쓰리햇다고 말햇다 이제 그만팔고 묻어둬라아직 갈길이 멀다,1
7080,2023-02-03,코오롱모빌리티그룹,어종상이다 뮬량 다 털었으니 호가창 알짱되는 단타충들 얼씬못하게하자,1
7081,2023-02-03,코오롱모빌리티그룹,고점에 또 달려든 흑우들 손,1
7082,2023-02-03,코오롱모빌리티그룹,형이다 형은 우선주 들어갔다 현재 상쳤네 근데 아쉬운건 주밖에 못드갔네 나처럼 차매수해놓으면 거래랑 트는거보고 이렇게 진입해서 수익나는거야 어제 손절친 호구들 자기손으로 씨게 대갈빡 존나씨게 친다 실시,1
7083,2023-02-03,코오롱모빌리티그룹,상앙까냄세나서킁킁 들어왔시요,1
7084,2023-02-03,코오롱모빌리티그룹,유통주식 프로 나머진 다 코오롱꺼 작전치기좋네,1
7085,2023-02-03,코오롱모빌리티그룹,상냄새 풀풀난다 전신들차려,1
7086,2023-02-03,코오롱모빌리티그룹,우선주와 역전 담주,1
7087,2023-02-03,코오롱모빌리티그룹,안티 나와라 오바 껄껄껄 이러이 니들이 돈을 못버는고야 벌써 수익이 천넘어간다,1
7088,2023-02-03,코오롱모빌리티그룹,우선주를 더 사야 했군,1
7089,2023-02-03,코오롱모빌리티그룹,본주는 글럿네 힘이 너무 약하다,1
7090,2023-02-03,코오롱모빌리티그룹,미더따 그래 코오론 아이가 미더따,1
7091,2023-02-03,코오롱모빌리티그룹,굿 원에 매수해서 원에 전량매도 짭잘하네요 굿,1
7092,2023-02-03,코오롱모빌리티그룹,어제 종가로 샀는데 잘먹고갑니다 꺼 어억,1
7093,2023-02-03,코오롱모빌리티그룹,어제 졸라 샀는데 땡큐,1
7094,2023-02-03,코오롱모빌리티그룹,거래량이 좀더 실렸으면 좋겠네요 형님덜,1
7095,2023-02-03,코오롱모빌리티그룹,우선주는 상한가것네요,1
7096,2023-02-03,코오롱모빌리티그룹,우선주 부럽다,1
7097,2023-02-03,코오롱모빌리티그룹,어제 존나삿쥬,1
7098,2023-02-03,코오롱모빌리티그룹,흥분하지말어 몰빵치지마라떨어지면 모아가면된다방향은 우상향이다 시간지나 후회하지들 말어,1
7099,2023-02-03,코오롱모빌리티그룹,어종상 호가창 알짱되는 단타충들 박멸했으니 이제 물량잠궈 얼씬못하게하자,1
7100,2023-02-03,코오롱모빌리티그룹,탑승완료 오브젠 먹고 갈아탓다,1
7101,2023-02-03,코오롱모빌리티그룹,상같은소리하네 절대못간다 잡주,1
7102,2023-02-03,코오롱모빌리티그룹,오늘까지 보라고 했죠 내가 어제 쫄아서 던진 심약개미는 타지 말고 차트상으로도 곧 반등 예정,1
7103,2023-02-03,코오롱모빌리티그룹,오늘상갈듯 만갈듯,1
7104,2023-02-03,코오롱모빌리티그룹,전부손절하고 떠납니다 성투들,1
7105,2023-02-03,코오롱모빌리티그룹,겁나 빌빌거리네 오늘 한 프로쯤 올라버렸음 좋겠다,1
7106,2023-02-03,코오롱모빌리티그룹,탈출기회 는 주는구나 빨리,1
7107,2023-02-03,코오롱모빌리티그룹,와 역시 우 주가가 더 급등 우를 사야 했네,1
7108,2023-02-03,코오롱모빌리티그룹,오브젠 가만 들고 있는건데 하 이새끼 첫날 들와서 개망이네,1
7109,2023-02-03,코오롱모빌리티그룹,오늘은 대 하락만 되어도 감사합니다 이틀간 대 하락때메 식겁 했습니다 다음주도 매일 매일 한 대 하락만 시켜주세요 그러면 안 징징대고 겸허히 받아드릴게요 그래서 한 원대까지 내려가면 손절할게용,1
7110,2023-02-03,코오롱모빌리티그룹,모아데이타 오늘 상간다 빨리사라,1
7111,2023-02-03,코오롱모빌리티그룹,이런주식은 왜 나오는지 아니 머야,1
7112,2023-02-03,코오롱모빌리티그룹,코오롱주는 사는게 아니다,1
7113,2023-02-03,코오롱모빌리티그룹,원에 물려잇다 혼자잇고싶어요 다 나가주세요,1
7114,2023-02-03,코오롱모빌리티그룹,이회사가치 억은되냐 하 쓰바,1
7115,2023-02-03,코오롱모빌리티그룹,폭탄 누가 받나 누가받나,1
7116,2023-02-03,코오롱모빌리티그룹,그냥 망해라 제발 하,1
7117,2023-02-03,코오롱모빌리티그룹,시총삼천은 싸다 시총 오육천이 되야 그룹인데작정하고 밀고 키울건데그래야 승계 지,1
7118,2023-02-03,코오롱모빌리티그룹,아무리 그래도 천원 아래는 말이 안되지 그룹주가 시총 천억,1
7119,2023-02-03,코오롱모빌리티그룹,천원이탈하면 원 까지는 골파기 한번 올것같은데,1
7120,2023-02-03,코오롱모빌리티그룹,시초가 고가 전부손절 각,1
7121,2023-02-03,코오롱모빌리티그룹,오늘은 얼마나 개폭락할지,1
7122,2023-02-02,코오롱모빌리티그룹,당분간 올라가기 힘들겠네요 차익실현 끝내야 가지,-1
7123,2023-02-02,코오롱모빌리티그룹,미 증시 난리났네 낼 이빠이 오르겠군,-1
7124,2023-02-02,코오롱모빌리티그룹,미 증시 난리났네 많이 오를거임,-1
7125,2023-02-02,코오롱모빌리티그룹,손절하니 속이후련하다 시 개잡주 코오롱 코만붙어도 개똥주 안산다 님들 코롱붙으면 쳐다도 보지마세요주식으로 돈벌라고 낚시질하는 놈들입니다 괜히 사서 맘고생 하지마세요 코닥 똥전주도 안그렇겟다오죽하면 재상장해서 초보개미들 뱃겨먹을려할까,-1
7126,2023-02-02,코오롱모빌리티그룹,사고싶은넘들이 왜이리 많어 그럼 사라 조정 받은 종목을 얼매나 더 싸게 살라고 완전 도둑심뽀네 비싸게 사서 더 비싸게 팔믄 되지 않냐 어짜피 만 되어도 낼름 팔롬들이 장투할놈이면 진즉 샀겠지,-1
7127,2023-02-02,코오롱모빌리티그룹,살때는 신중하게 팔때는 냉정하고 과감하게 아직 매수 타이밍 아닙니다,-1
7128,2023-02-02,코오롱모빌리티그룹,주린이 힘내십시요 온갖 대출 다 받아서 원대 오면 크게 분할로 번 매수해서 단가 내려서 빨간색 볼 수 있기를 응원한다 그 외 어제 몰빵 개미들은 자기손으로 대갈빡 씨게 때린다 실시,-1
7129,2023-02-02,코오롱모빌리티그룹,이거 곧 폭망할듯 전부 던짐,-1
7130,2023-02-02,코오롱모빌리티그룹,시외 전부 손절 개쌍,-1
7131,2023-02-02,코오롱모빌리티그룹,자 주린이 물린 호구들 잘보시오 외인 기관 전부 올매도 개인만 매수 내일도 하락하니깐 참고해 내일은 원 깨지고 내일 종가 에 분할 매수하면돼 어제 깝치다가 몰빵해서 현재 손절도 못치는 호구들 자기손으로 대갈빡 존니 쎄게 친다 실시 아마 세력들은 원부터 매집하여 올릴거같애 그전까지 물린 호구들은 존네 스트레스 받겠지 더 스트레스 받는건 원에서 상승인 원 초반대만 올리고 다시 폭락시킬꺼야 어제물린 호구들은 영원히 몇년 동안 탈출 못함,-1
7132,2023-02-02,코오롱모빌리티그룹,시외 쩜상,-1
7133,2023-02-02,코오롱모빌리티그룹,오늘 종베 못한 쫄보읍제 내일 기술적 반등 윗꼬리 먹어야제 내일도 윗꼬리 없는 음봉 그건 아닐듯힘 좋으면 고점돌파까지 노려볼만함,-1
7134,2023-02-02,코오롱모빌리티그룹,금융투자는 어제 오늘도 소량매수 기타법인이 만주이상 다시 들어오기시작 아무리 생각해도 시총이 말이안되지 그룹인데 천억은 돈안되는 찌라시 중소기업도 찌라시 띄워서 수두룩,-1
7135,2023-02-02,코오롱모빌리티그룹,풀매수자리 원대,-1
7136,2023-02-02,코오롱모빌리티그룹,막판에 끌어 올렸네 덕분에 수익났네 내일 오를 자리인 같은데 과연 어떨지,-1
7137,2023-02-02,코오롱모빌리티그룹,오널 시장이살렸다 낼부터 각오해라,-1
7138,2023-02-02,코오롱모빌리티그룹,에서 개미 털고 싹 가져갔어 낼 보자,-1
7139,2023-02-02,코오롱모빌리티그룹,선에서 매수하는중이었는데 소액 나가리됐네요 원에 쌓아둔건데 싹가져가셨네,-1
7140,2023-02-02,코오롱모빌리티그룹,마지막 탑승시간 분전 오늘 이후로 층 볼일 없다고 본다,-1
7141,2023-02-02,코오롱모빌리티그룹,오브젠 미래반도체 비슷하게 갈끼다 낼 아님 모레 가니깐 진득하게 기둘려 고점 물린놈들은 본전오면 절반 팔고 홀딩하다가 떨어지면 눌림목매수해서 가꼬가 내가 이런거까지 알려줘야 되냐,-1
7142,2023-02-02,코오롱모빌리티그룹,그냥 소액 집어넣어봤어요 내일 폭락이죠,-1
7143,2023-02-02,코오롱모빌리티그룹,종가배팅 유효 낼 채소 먹는다 이런 놈 많이 봐와따 큰거 한장 넣는다 항시 음봉에 사라 양봉에 사서 쳐맞지말고,-1
7144,2023-02-02,코오롱모빌리티그룹,사자마자 누군가 싹 긁어갔내 개꿀,-1
7145,2023-02-02,코오롱모빌리티그룹,풀매수 자리,-1
7146,2023-02-02,코오롱모빌리티그룹,오늘부터 계속 쭉 나락임 경험상 코오롱이 원래 그래 아직 손절못햇는디,-1
7147,2023-02-02,코오롱모빌리티그룹,희망없네 년뒤 원 올란가,-1
7148,2023-02-02,코오롱모빌리티그룹,묻고 몇달뒤에 오겠다 아님 말고 스트레스는 해로워요,-1
7149,2023-02-02,코오롱모빌리티그룹,잡고 있지마라 내일부터 더 떨어진다 빨리 익절해라 인간들아,-1
7150,2023-02-02,코오롱모빌리티그룹,내일까진 봐야지 금요일에 꼬라박으면 정상,-1
7151,2023-02-02,코오롱모빌리티그룹,어제 잘참앗네 이제 함드가자 종가 양전하자,-1
7152,2023-02-02,코오롱모빌리티그룹,이건 오래 팔이유가없지 코오롱이 프로가지고있는데걔네들이 팔리는없고,-1
7153,2023-02-02,코오롱모빌리티그룹,아가리 쩌억 굿,-1
7154,2023-02-02,코오롱모빌리티그룹,아따 호구 왔는가,-1
7155,2023-02-02,코오롱모빌리티그룹,주식은 재밌어 다들 오늘 떨어질거 알고있었던거 아니야,-1
7156,2023-02-02,코오롱모빌리티그룹,이러다 상가면 웃길듯 충분가능하,-1
7157,2023-02-02,코오롱모빌리티그룹,아오 진짜 개 빡치네,-1
