,날짜,기업명,정제된 댓글,상승_하락
3901,2023-02-06,AP위성,단일가 먹고 가즈아 단일가 먹으면서 가보자,1
3902,2023-02-06,AP위성,개미가 많아도 개미다 외인에 기업이 사면 개미는 개미,1
3903,2023-02-06,AP위성,안티들 바로 버로우 안티형들 이거나먹어 카악 퉤,1
3904,2023-02-06,AP위성,좋은종목을 팔았다 신발끈 풀렸다 신발끈 아 신발끈,1
3905,2023-02-06,AP위성,또 개랄지를 쳐하네,1
3906,2023-02-06,AP위성,상한가라고 분명 말했는데,1
3907,2023-02-06,AP위성,크으 내일 보고 들어왔는데 오늘 갈라 하노 내일까지 달리자,1
3908,2023-02-06,AP위성,다시 가보자 고수님들 이거 올라갈 거 같나요,1
3909,2023-02-06,AP위성,우리도 상쳐봤으면 비나이다,1
3910,2023-02-06,AP위성,좋은주식인데 아쉽다,1
3911,2023-02-06,AP위성,언제 매수 할까요,1
3912,2023-02-06,AP위성,개미 너무많다 한참 더 털어내야됨 빨리좀 던지고 나가주라,1
3913,2023-02-06,AP위성,끌어올려라 상 한번 더가고 단기과열 지정 받아라,1
3914,2023-02-06,AP위성,오늘의 고가 원 이상에서 매수하신 주주분들은 정말로 존나게 짜증나겠다 그쵸,1
3915,2023-02-06,AP위성,물려서 매도한 분들 만회기회 있습니다 아직 안늦었습니다,1
3916,2023-02-06,AP위성,이제 수급 많이 들어갑니다 보시죠 개미들 어느 정도 떨어졌으니,1
3917,2023-02-06,AP위성,매도했다 이런잡주 다신 안본다 쓰레기도아니고,1
3918,2023-02-06,AP위성,오늘 상한가갈 확률,1
3919,2023-02-06,AP위성,쑈하네 내일 급등하긋네 종가에 풀매수다 냄새맡아버렸다 나는 만원 바로 가긋네 조망간,1
3920,2023-02-06,AP위성,외인 기관 왔다 상한가다,1
3921,2023-02-06,AP위성,입성했습니다 잘 부탁드립니다,1
3922,2023-02-06,AP위성,목표가 만 월 누리호 이벤트,1
3923,2023-02-06,AP위성,는 아니지만 그만 조정하고 패턴상 반등 및 상승 시간이 오는 것 같다프매도한 넘 잔머리 꽤나 굴리누만,1
3924,2023-02-06,AP위성,원까지는 내린다조심,1
3925,2023-02-06,AP위성,불나방들 피말리네 올렸다 내렸다 프로짜리를 몇번반복하는거여 힘들제 응디 딱 붙혀 그냥,1
3926,2023-02-06,AP위성,어제 저점은 지키네 양봉까지도 바라지 않는다 어제 종가정도에서 마무리 해도 좋다,1
3927,2023-02-06,AP위성,내일 보고 샀다 내일 크게 간다 주구장창 설명하면 뭐하니 그냥 감이야 감 내일 보자구,1
3928,2023-02-06,AP위성,어쩌면좋냐,1
3929,2023-02-06,AP위성,아이고 찬티들 다죽 구나,1
3930,2023-02-06,AP위성,개폭락,1
3931,2023-02-06,AP위성,아직 위성은 오바지 마넌 간다,1
3932,2023-02-06,AP위성,투자주의 언제 풀리냐,1
3933,2023-02-06,AP위성,개폭락 세력들 한입거리 개미 세퀴들,1
3934,2023-02-06,AP위성,쩜상쩜상 거리건 찬티들 어데감,1
3935,2023-02-06,AP위성,잘먹었다 꺼억 금욜날 종배 오늘 에 전량 매도 사요나라 스고이 잘먹고 갑니다 꺼억,1
3936,2023-02-06,AP위성,이건 마넌 깨짐,1
3937,2023-02-06,AP위성,안그래도 유통물량 없는디 잘내어주네 어이쿠야,1
3938,2023-02-06,AP위성,수익 고점 매도 잘 먹고 갑니다 조정 받으면 다시 입성예정,1
3939,2023-02-06,AP위성,코스피가 음봉이여,1
3940,2023-02-06,AP위성,이거 신규 잘못들어가다간골로 갈수도 있겠다 조심조심 신중히 매수 매도해라 년 넘게 묶인주주들 태반이다,1
3941,2023-02-06,AP위성,충분이 털엇다 다시가자,1
3942,2023-02-06,AP위성,머스크 일론 상한가 간다,1
3943,2023-02-06,AP위성,응 안티들 돈 못벌구 냐미,1
3944,2023-02-06,AP위성,물량터진다 얼라려 살까,1
3945,2023-02-06,AP위성,금욜에 재진입 할수있게 물량주신분들,1
3946,2023-02-06,AP위성,상한가가 아니라 상가집이네요,1
3947,2023-02-06,AP위성,에이 허매수네 아니네 못가겟네 하면서 실망감 을 키워주고 흔들리는 얘들 팔고 나가는 거란다,1
3948,2023-02-06,AP위성,슬슬 빼는구나,1
3949,2023-02-06,AP위성,그냥 위성주라 이리 호들갑일까 가장 현실적으로 생각하믄 답나옴,1
3950,2023-02-06,AP위성,상한가를 보여주면서 허매수로 자꾸 보여주면서 기존 개미들 에게 희망 다 뺏었다 하면서 실망감 키워서 물량 털어 먹는거야 그걸 몰라,1
3951,2023-02-06,AP위성,연상 가자,1
3952,2023-02-06,AP위성,상한가 걸어는 놨는데 과연 팔릴까 팔리면 주포님으로 모십니다,1
3953,2023-02-06,AP위성,허매수라도 잠시 꿈을 꾸게 해줘서 고맙다,1
3954,2023-02-06,AP위성,속보 시외 매물대 만주 쩜상 조심스럽게 예상해봅니다,1
3955,2023-02-06,AP위성,속보 중국 정찰기 격추 조심스럽게 상한가 예상함,1
3956,2023-02-06,AP위성,만 캬,1
3957,2023-02-06,AP위성,언제 갈지는 모르겠는데 였나 찍는 예지몽 꿨습니다 매수 하시죠 이 글은 성지가 됩니다,1
3958,2023-02-05,AP위성,월요일 만원 터치한다 강력하게 말아올린다 첩보 수집했다,0
3959,2023-02-05,AP위성,머스크형이 한국에 통신사 차린다는데 도지 결제 가즈아 우크라이나도 위성으로 인테넷 쓰는데 위성도 가즈아,0
3960,2023-02-03,AP위성,만 캬 좋다,-1
3961,2023-02-03,AP위성,내내 속앓이 하면서 한달 좀 갖고있다 얼마전에 팔아버렸는데 원에 주 사서 인내심부족결과로 계좌는 피멍 저게 한 원 사이에 재진입시도 제 의코난일듯 일단 우주중에 최초가 붙은게 있어서 곧 빛을 발할듯 담에 만원,-1
3962,2023-02-03,AP위성,오늘 추매 잘한것 같다 담주 오르면 좋고아니면 기다리면 되고 종목은 맘에 든다 굿,-1
3963,2023-02-03,AP위성,한번 발싸 할려고 위아래 워밍업 하는것같은데흥분지대로되면 발싸,-1
3964,2023-02-03,AP위성,나도한번 해보고 싶다 억 가지고 설레게 하긔,-1
3965,2023-02-03,AP위성,시간외 쏘 올 수 있어 쏘 올수 있써,-1
3966,2023-02-03,AP위성,나이스하네 굿굿,-1
3967,2023-02-03,AP위성,그지 한테 잘못걸렸네,-1
3968,2023-02-03,AP위성,개자 슥 역대급 단일가 약올리네,-1
3969,2023-02-03,AP위성,쓰윽 빼겟지,-1
3970,2023-02-03,AP위성,상에팔려라 제발 월요일털기위해작전쓰네 월요장은월요일날보구하자 만벌자,-1
3971,2023-02-03,AP위성,찐 이번은 찐이다,-1
3972,2023-02-03,AP위성,허매수로 사기치치마라 종가 하한가,-1
3973,2023-02-03,AP위성,존나 웃기네 정전,-1
3974,2023-02-03,AP위성,정전 플리즈 정전 나라,-1
3975,2023-02-03,AP위성,제발 정전되라 부탁이다 정신차리지,-1
3976,2023-02-03,AP위성,주포 놀고 있어요 정전되라 얍,-1
3977,2023-02-03,AP위성,와 새로운 세력들 물량 넘기기 기법인데 단기과열 예고 뜨고 다음날 횡보 시간외 상한가 만들고 다음날 갭떠서 올려서 위부터 팔아 먹으면서보합 만들면 대박인디,-1
3978,2023-02-03,AP위성,물량 내놔 줘,-1
3979,2023-02-03,AP위성,물량고맙습니다 재입성 굿,-1
3980,2023-02-03,AP위성,마지만 타임 주폰 황금손 마이다스,-1
3981,2023-02-03,AP위성,풍선이 날라다녀서 올라가네,-1
3982,2023-02-03,AP위성,손절 안하길 잘했네 차트는 거짓말 안하네,-1
3983,2023-02-03,AP위성,쬐매 조종좀 했다고 아주 안티질을 하고 난리들이 났네 주식 원데이 투데이 하냐 아주 생 난리들을 쳐요 진득히좀 기둘려 알서서 운전해주고 있잖어 그정도 배포도 없으면 주식시장에 몸담으면 안되지 금리도 좋은데 은행에 적금넣어 하루 쬐끔 내린다고 난리들이 났어 아주 참나 맨날 올려주까 어이없네,-1
3984,2023-02-03,AP위성,매도,-1
3985,2023-02-03,AP위성,나스닥이 폭락중이라 추매보단 물량을 줄여야 하나 고민이네,-1
3986,2023-02-03,AP위성,쭉쭉가자 년을 묶잇다 담주단일가가고미친듯이가보자,-1
3987,2023-02-03,AP위성,시외 따라붙엇다잉 간다잇,-1
3988,2023-02-03,AP위성,월욜 상한가다,-1
3989,2023-02-03,AP위성,내가 원 절대 안깬다고 세번 말했지 느낌알지 굳이 풀어서 설명안해줘도,-1
3990,2023-02-03,AP위성,팩트 한그릇 낚시질해서 올려 산 흑우들뱉어내는거 밑에서 받아먹을려는 악질주포,-1
3991,2023-02-03,AP위성,이번탐에 살짝 더 담궜다 인생 뭐 있나 한번 드가 보는거지 뭐,-1
3992,2023-02-03,AP위성,뭐야 한딱가리 하자는 건가 왜 이리 시간외 나대냐 걍 조용히 가자 춤춰서 좋을것 없어,-1
3993,2023-02-03,AP위성,주 딱지 달고 가주면 땡큐 안가도 땡큐다,-1
3994,2023-02-03,AP위성,목표가 원 털리지 말자 물량 원대 다신 못본다,-1
3995,2023-02-03,AP위성,당분간 보합으로 가면서 힘을 축적하여 슛팅 가자이만하면 선방 성투합시다,-1
3996,2023-02-03,AP위성,이정도면 선방했다 굿굿 재료 소멸도 아니고 스페이스 우주항공 관련 나올 재료는 무궁무진 홀딩 관점 이번주도 고생 많으셨습니다,-1
3997,2023-02-03,AP위성,약속의 시 분 보면안다 그땐 못사,-1
3998,2023-02-03,AP위성,푸근하네 작년 종토방 내글 찾아보면 답나온다 천원때부터 계속 모아갔디만 이런날도 오는구나 위성통신 커질줄 알았다,-1
3999,2023-02-03,AP위성,간다고 해도 며칠은 조정 해야하고 털어먹고 있는거면심각히 생각해야함 주포가 폐급임,-1
4000,2023-02-03,AP위성,조정줄때 탑승하소 곧 없어서 못 산다,-1
4001,2023-02-03,AP위성,오늘은 까지만 가주세요 나갈꺼예요,-1
4002,2023-02-03,AP위성,오늘 매수하는 개미는 주식하지마라,-1
4003,2023-02-03,AP위성,프매 물량턴다 조심,-1
4004,2023-02-03,AP위성,개미가 안파니 꼬시기 하방갑니다,-1
4005,2023-02-03,AP위성,단일가 안 걸리려고 추잡 떠네 이렁 종목은 안된다,-1
4006,2023-02-03,AP위성,내가 원 안깨는 이유 있댔지 왜 말을 안들어 쳐머거서 돈을 잃니 힌트를 공짜로 줘도 참,-1
4007,2023-02-03,AP위성,어차피 월요일도 하락임 대기,-1
4008,2023-02-03,AP위성,원 안깨는 이유 있다고 분명히 말했다 힌트 더 안줘도 되지,-1
4009,2023-02-03,AP위성,내일 투자주의 풀리는거 맞죠,-1
4010,2023-02-03,AP위성,손절하니깐 위로가냐 같은것,-1
4011,2023-02-03,AP위성,버팁시다 혼자죽을순 없죠,-1
4012,2023-02-03,AP위성,위성 그런거 다 필요없음 그냥 니들 돈 뺏는거야 털려보니 알겠네,-1
4013,2023-02-03,AP위성,우주항공 끝인가 영 힘이 없네,-1
4014,2023-02-03,AP위성,어짜피 세력 조사들어갈건데 걍 무시하구 가라,-1
4015,2023-02-03,AP위성,원 끝까지 지켜낸다는게 무슨 의미인줄 알지 힌트 다줬다,-1
4016,2023-02-03,AP위성,위성주는 하나 들어오믄 사는날이지 안티알바들 힘내서 열심히 하그라,-1
4017,2023-02-03,AP위성,하나만 알려줄게 여기서 털리면 개 등신인거알지,-1
4018,2023-02-03,AP위성,형이 어제 그렇게 말해줬는데도 정신을 못차린 찬티놈들,-1
4019,2023-02-03,AP위성,애 없는 종목은 뭐다 손절한다 더러운종목이네,-1
4020,2023-02-03,AP위성,뽀드득 형님들 계좌 설거지중,-1
4021,2023-02-03,AP위성,현 내가 볼땐 이거 넘길듯,-1
4022,2023-02-03,AP위성,주일동안 신용이 너무 많이 붙었어 어떡해,-1
4023,2023-02-03,AP위성,한강갈사람 그건바로 나,-1
4024,2023-02-03,AP위성,월욜은 미수썼는디 된장,-1
4025,2023-02-03,AP위성,이게 떨어진거냐 상위 퍼 쉐이들 하루만에 수익보고난 하위 퍼니 한두달 기다릴란다,-1
4026,2023-02-03,AP위성,키움개미들 풀매수중 더떨어질텐데,-1
4027,2023-02-03,AP위성,어제 알려줬지 오늘도 팔아먹으려고 종가관리한거라고 세력들 물량 다넘겼다 수고해라 고가 부터 까지 시장가로 매도하다가 분간 종가 관리한다고 잠깐 매수한거가지고 난리가나더라고 어제,-1
4028,2023-02-03,AP위성,어제 알려줬지 오늘도 팔아먹으려고 종가관리한거라고 알았으니 아닥하라고 있지말고,-1
4029,2023-02-03,AP위성,찬티들 어제터는게 정상적인 생각아니냐,-1
4030,2023-02-03,AP위성,어제 발언 취소한다 위성 추락한거같다 조졌네,-1
4031,2023-02-03,AP위성,켄코아에어로스페이스 여기가 진짜인듯,-1
4032,2023-02-03,AP위성,어제 버진갤럭틱이니뭐니 말도안되는 소리하고 형말이 맞지,-1
4033,2023-02-03,AP위성,잔인하다 털리는 개미들 이 바보들아 아직도 모르겠어,-1
4034,2023-02-03,AP위성,위성 추락햇나 엉,-1
4035,2023-02-03,AP위성,간다 좀있다,-1
4036,2023-02-03,AP위성,오늘 털리면 바보탱이 단일가 거래 피하기위해 오늘은 쉬어간다,-1
4037,2023-02-03,AP위성,이제 쎄트렉아이가 되장되는겨,-1
4038,2023-02-03,AP위성,상황을 봐봐 이거 안사고 나중에 후회할래요 내려주면 오히려 땡큐임,-1
4039,2023-02-03,AP위성,위성의 서막이 열립니다 이만 이하일때 무조건 쟁겨두길굿럭,-1
4040,2023-02-03,AP위성,미국 우주항공주 버진갤럭틱 급등 마감 급등 마감 로봇 다음은우주항공,-1
4041,2023-02-03,AP위성,헐 하한가 뉴스,-1
4042,2023-02-02,AP위성,위성시장 조 돈되는 위성이 안보이는 보다는 폭발성,1
4043,2023-02-02,AP위성,단기성호재 얘는 단기성 호재로 어제 상한가 간게 아니다 만약 단기성이었다면 오늘 같은 지지대는 없었을 것이며 나도 미련없이 매도하고 쳐다도 안봤을 것이다 스타링크 등 우주 관련 테마의 대장주다 내일 주가 상승하여 단기과열종목 지정되어 단일가 매매되도 하루 이틀 떨어질 수 있어도 우상향 할 놈이다,1
4044,2023-02-02,AP위성,기회가 왔슴돠 힙냅시다 내일은 좀더 강한 우상향나왔으면 좋겠네요,1
4045,2023-02-02,AP위성,참 마이 올랐다 실적도 읍는게 이거이 주식 진면목이네,1
4046,2023-02-02,AP위성,월달까지 장투 오르락 내리락 하다어느새 만원대는 가겠지요,1
4047,2023-02-02,AP위성,아주 좋아 굿 매물대소화하는중고점에 물리신분들 손절금지요 낼시세한번 더주고 담주부터본격적으로 파동주면서 올릴거다 말해줬다차트 예쁘게 만들어 갈겁니다 나스닥선물도 겁나오르고 낼도불장이당,1
4048,2023-02-02,AP위성,단기과열 스팸 찍고 상승한 종목 찾아봐라 코난 솔트룩스같은 대장주 밖에없다 전세계 다 난리나고 대통령까지 나오니까 그정도 주가오르는건데 그런 주식들이 위성처럼 찍고 까지 쳐밀리디 찬티놈들 내일 개쳐맞아야지 윗꼬리 길이가 몸통 두배인데 오늘 오전에 까지 가격 분도 지지 못하고 세력이 시장가 매도로 물량 다떠넘기고 까지 내리다가 내일도 팔아먹으려고 종가관리한다고 시부터 얇은호가 매수해줘서 올랐더니 신나서 발작하네 너네나 많이사,1
4049,2023-02-02,AP위성,천원대 평단은 안티들이 귀엽다 사고 싶어서 징징대는거 팝콘먹으면서 구경중 글 재밌게 써서 웃기면 한주 팔아드림 캬캬 응디 딱 붙혀,1
4050,2023-02-02,AP위성,갭하락 출발 유력 아주 천천히 사도 됨,1
4051,2023-02-02,AP위성,말했지 설거지라고 스팸과다랑단기과열 개 지정떳네 부터 시장가로 내내 물량 매도하다가 까지 팔고 분남았을때 종가관리해서 내일도 물량 넘길려고호가 얇아진거 올려줬다고 개미들 좋다고 난리가 낫지 내일도 매수해서 많이사라,1
4052,2023-02-02,AP위성,인생망햇 다 쉬 랄 자솬싸러간다,1
4053,2023-02-02,AP위성,내일도 팔아먹으려고 종가 관리 한거가지고 상승이러고있네 오늘 에서 시장가로 대량 물량 던지면서시장가로 까지 밀어팔다가 내일 남은 물량 설거지 마저할라고 종가 살짝 들어 올려주니까 개미들 신낫네 내일도 개미들이 매수 호가 밑에 받치면 시장가 매도야 수고해라 하루종일 시장가로 던지다가 호가 얇아진거 딱 분 잠깐 매수 해주니까 난리가났네 많이들사라,1
4054,2023-02-02,AP위성,단기과열이면 올리기 더 좋지 저걸 약 오르라고 하고 있네,1
4055,2023-02-02,AP위성,어라 기관 어제사고 매도 안했네 더오를꺼 보고있나봐 히히 히히,1
4056,2023-02-02,AP위성,종가 원 맞춰놔라 담주부턴 불쇼다,1
4057,2023-02-02,AP위성,위성 시외 수급 더 몰립니다 홀딩하세요 위성 일시조정 따른 시세 이탈이라 손절없고 홀딩한다했죠 시외 매집예상 구간 잡아드렸으니 진입단가 높더라도 홀딩하시고 하단 댓글로 내용확인하세요,1
4058,2023-02-02,AP위성,내일도 설거지 마저할려고 종가 관리하는건데 딱 일전에 로보스타가 고점에서 이렇게 거래량없이 시부터 들어올리더니 다음날부터 바로 장대음봉때렸는데 설거지인줄도모르고,1
4059,2023-02-02,AP위성,꼭 띠발 몇호가 욕심부리다 못사면 가더라 아,1
4060,2023-02-02,AP위성,누리호때물린형들많이나갔나 아침에다나갔겟제,1
4061,2023-02-02,AP위성,프로그램 다시 양전매수햇네 기회는 다시 오겠군,1
4062,2023-02-02,AP위성,쭉 안빼는거보니 내일 달리려나보네 뻔하지뭐,1
4063,2023-02-02,AP위성,장대음봉,1
4064,2023-02-02,AP위성,얼마나 갈라고 굿굿,1
4065,2023-02-02,AP위성,내일은 음봉 다시올게요,1
4066,2023-02-02,AP위성,지지리 복도 없지 소니드 코모 상 먹을거 놓치고 물렸네,1
4067,2023-02-02,AP위성,형말이 맞지 방금 만주 한번에 던지는거 위에 매수하는척 호가 올리고개미들이 매수호가 받치면 시장가 던지고 수고해라,1
4068,2023-02-02,AP위성,단일가 조심하면서 운전 잘해주세요 형님들 현재까진 아주 좋아여,1
4069,2023-02-02,AP위성,슬슬 마지막 설거지들어간다 위에 호가 잡아먹는척 하고 매수받치면 시장가 던지기,1
4070,2023-02-02,AP위성,자 이제 슬슬 시동걸자 팔사람은 빨리 팔고 딴데 가시오 미련떨지말고,1
4071,2023-02-02,AP위성,지금 안팔면 나락감 빨리파셈,1
4072,2023-02-02,AP위성,최강의 안티 종목 이 종목에 원한 맺힌 자들이 왜 이리 많은지 알 수가 없네,1
4073,2023-02-02,AP위성,지금 형이 얘기해준다 팔어라 계속 입아프게 하지말어 팔어 이거 다시 밑으로간다,1
4074,2023-02-02,AP위성,거봐 형말이 맞지 종가로 갈수록 하락이야 세력이 넘긴 물량 받아먹은 개미들 손절치고미수 신용 손절치고기존에 들고있던애들 익절하고 오늘 매매동향에서 기관 외인 다던졌을꺼다 시간외 본다,1
4075,2023-02-02,AP위성,매일 천원씩 내려갑니다 만원 밑으로 매집하세요 급등주이구요 공매도가 매일 천원씩 내릴듯 주 정도 기다렸다가 만원 밑으로 매집하세요,1
4076,2023-02-02,AP위성,딱 만 올려줄 수 없겠나 평단가를 훅 뛰어넘으라는 것도 아니고 상한가를 가달라는 것도 아니다 내한테 딱 한번만 가주면 안되겠나,1
4077,2023-02-02,AP위성,오늘 종가는 원 대면 좋겠어요 감사합니다,1
4078,2023-02-02,AP위성,지금이라도 쳐 파십쇼 형님들 관짝 들어가는날 전에도 절대 복구안됩니다,1
4079,2023-02-02,AP위성,시전까지 어제 오늘 미수 물량 쏟아진다 시간외도 그럴꺼고,1
4080,2023-02-02,AP위성,아오,1
4081,2023-02-02,AP위성,여기가 홍보다니는 위성 맞나 끝난 종목이네 알바들 타 종목에서 득실득실,1
4082,2023-02-02,AP위성,우리나라는 인터넷 강국이라 위성은 어떨지 기대되네요인터넷보다 빠르면 대박나는거겠죠빠를거같진 않지만,1
4083,2023-02-02,AP위성,대 대 사이를 못 뚫을거 같은데 대 대 사이를 못 뚫을거 같은데 다들 무슨 어떻게 생각하는지 궁금하네요 사진 않았지만 구경중인 종목,1
4084,2023-02-02,AP위성,진짜 죽은종목 퍼다 손절 진심,1
4085,2023-02-02,AP위성,공시 없으면 나락가겠는데 머스크와 협업정도,1
4086,2023-02-02,AP위성,형이 고수인데 예언하나 할게 오늘 매매동향 기관 외국인 싹다 매도일꺼다그리고 시간외 빠지고 낼 시가부터 하락간다 형이 다른종목 글 잘맞추거든 확인하던가,1
4087,2023-02-02,AP위성,아까 쌍봉이라고 넣으라 할때가 원이닷지금이라도 넣어라 후회말공,1
4088,2023-02-02,AP위성,세력님들 오널 털고 나가셨네 거래량도 개판 개미들만 남았네,1
4089,2023-02-02,AP위성,거래량보니 내일은 장대음봉자리네 잘가라,1
4090,2023-02-02,AP위성,여기 까지가 끝인가보오,1
4091,2023-02-02,AP위성,좀 그냥 털려주면안되냐 어차피 단타쟁이들 여기서 털릴거잖아 손절칠거면 지금좀 쳐 니들좀 버리고가게 제발,1
4092,2023-02-02,AP위성,슬슬 모아볼까 이제 흠,1
4093,2023-02-02,AP위성,찬티들 바글바글한거보니 한참 더빠져야한다 형은 어제사서 오늘 에 다던졌지,1
4094,2023-02-02,AP위성,밑으로 다걷는다 와우 이런행운이 잘묵을게,1
4095,2023-02-02,AP위성,쌍봉이닷 이제 넣어랏,1
4096,2023-02-02,AP위성,위성은 찐퉁이 아니다 켄코가 스타링크 찐퉁이다,1
4097,2023-02-02,AP위성,끝 수고하셨습니다 끝,1
4098,2023-02-02,AP위성,꺅 탈출성공 성투하시길요 층탈출성공,1
4099,2023-02-02,AP위성,잘먹었다 하루 면 나쁘지않네,1
4100,2023-02-02,AP위성,어 이건 아닌데,1
4101,2023-02-02,AP위성,철저하게 개미들 한테 씌우고 튀는구나 역시 기관놈들 지저분해 개미털기 박사야 박사종가 장대음봉으로 개미나락,1
4102,2023-02-02,AP위성,쌍봉잡고상친다 봐라,1
4103,2023-02-02,AP위성,망했다,1
4104,2023-02-02,AP위성,누리호 차 성공하고 하한가 때린 종목임 니미,1
4105,2023-02-02,AP위성,어제 들어와서 아직 안팔았는데 이번주 들고갈까나,1
4106,2023-02-02,AP위성,사놓으시라 매집구간임,1
4107,2023-02-02,AP위성,대장 냐 쎄트냐 고민되네 스슬입질해보까,1
4108,2023-02-02,AP위성,단물 다빨렸는데 쳐물리뉴 단물 다빨렸는데 발라먹을게 얼마나 있다고 쳐물리십니까 개 가리 형님들 평생 깡통이나 차십쇼,1
4109,2023-02-02,AP위성,빨리팔어 답답이들 아직도 들고있어 이거 곧 로 가요 하한가가서 제말들을걸하지마세요 돈잃고 해장국드시지마시고 돈벌어서 술드세요,1
4110,2023-02-02,AP위성,이투주금액 까지전부매도개꿀,1
4111,2023-02-02,AP위성,시초가에 근접했다 초반 왕창 오르고 별 저항도 못하고 이게 중요함 쭈루룩 흘러내림 내려오는 와중에 거래량 터짐 이제 시초가에 근접함 주식에 는 없지만 이건 누가 봐도,1
4112,2023-02-02,AP위성,빨리매도하세요 갭하락합니다 지금 탈출해라 피보지마시고,1
4113,2023-02-02,AP위성,상투 정신 나간놈들만 이런 개잡주억 투자하지,1
4114,2023-02-02,AP위성,끝이네 낼부터 마이나스랍니다,1
4115,2023-02-02,AP위성,광고애들 오면 뭐다 씹나락,1
4116,2023-02-02,AP위성,대량거래 수반 주가 밀린다 팔아먹는중 만 천원까지 접근금지,1
4117,2023-02-02,AP위성,거래량 조온나 많은디 개떡락은 좆망햇다는뜻 껄껄,1
4118,2023-02-02,AP위성,추세가 하락 전환 고로 마넌 감,1
4119,2023-02-02,AP위성,오늘 거래량 절반이 초반 분에 몰렸다 그리고 지속적 하락 세력 털고 나갔고 좀 남은 걸로 설거지 중이라는 얘기,1
4120,2023-02-02,AP위성,퍼에서 퍼가 내려도 찬티를하네 껄껄,1
4121,2023-02-02,AP위성,프매도세 장난에 견디고 상승하려하니 꽤 든든한 개투들 화이팅,1
4122,2023-02-02,AP위성,난 왜 다시 달릴거 같지,1
4123,2023-02-02,AP위성,생각보다 힘이 괜찮네,1
4124,2023-02-02,AP위성,다음주 내로 만원 돌파 시세차트보면 별다른 호재 없이도 하루에 플러스 마이너스 정도는 찍던 넘임하루 아침에 꺼질 호재도 아니고이 호재만 바라보고 년이상 존버 탄 주주들도 수두룩 고로 만원 후반에서 만원은 확정,1
4125,2023-02-02,AP위성,년넘게 쳐물리고 에 행님은 간다 는 하루따리야원금찾는데 년걸렷다 행님은간다,1
4126,2023-02-02,AP위성,빨리 터세요 난 어제 털었지만얘 이러다가 년 넘게 물린 사람 많음,1
4127,2023-02-02,AP위성,화성 갈끄니깐아 가즈앙,1
4128,2023-02-02,AP위성,내일 무조건 하락,1
4129,2023-02-02,AP위성,설마 올라가지 않겠지,1
4130,2023-02-02,AP위성,에 걍 나왔다 수고들 혀라,1
4131,2023-02-02,AP위성,나 신용물량팔았다 잘갈꺼야많이들 드셔 백만 먹고갑니데이,1
4132,2023-02-02,AP위성,머스크 형이 얘기하겠네 머스크형님이 얘기있겄어요 준비들하세요,1
4133,2023-02-02,AP위성,풉 다빼네,1
4134,2023-02-02,AP위성,줄때먹자 찬티말 믿고 버티다끝은 마이너스다,1
4135,2023-02-02,AP위성,존버한 보람이 포기하고 있었더니 이런날도 오네요,1
4136,2023-02-02,AP위성,으휴 바뷰들 이걸 아직도 잡고잇네,1
